{
  "id": "HPL_NVIDIA/Sithum/massjob4",
  "suite": "HPL_NVIDIA",
  "group": "Sithum",
  "run": "massjob4",
  "dat": {
    "raw": "HPLinpack benchmark input file\nInnovative Computing Laboratory, University of Tennessee\nHPL.out      output file name (if any)\n6            device out (6=stdout,7=stderr,file)\n1            # of problems sizes (N)\n136704       Ns\n1            # of NBs\n512          NBs\n1            PMAP process mapping (0=Row-,1=Column-major)\n1            # of process grids (P x Q)\n2            Ps\n2            Qs\n16.0         threshold\n1            # of panel fact\n1            PFACTs (ignored by HPL-NVIDIA)\n1            # of recursive stopping criterium\n8            NBMINs (ignored)\n1            # of panels in recursion\n2            NDIVs\n1            # of recursive panel fact.\n1            RFACTs (ignored)\n1            # of broadcast\n3            BCASTs (ignored)\n1            # of lookahead depth\n2            DEPTHs (ignored)\n2            SWAP (0=bin-exch,1=long,2=mix)\n192          swapping threshold\n0            L1 in (ignored)\n1            U  in (ignored)\n1            Equilibration (ignored)\n32           memory alignment in double (> 0, ignored)",
    "parsed": {
      "header": [
        "HPLinpack benchmark input file",
        "Innovative Computing Laboratory, University of Tennessee"
      ],
      "outputFilename": "HPL.out",
      "deviceOut": 6,
      "numProblemSizes": 1,
      "Ns": [
        136704
      ],
      "numNBs": 1,
      "NBs": [
        512
      ],
      "pmap": 1,
      "numGrids": 1,
      "Ps": [
        2
      ],
      "Qs": [
        2
      ],
      "threshold": 16,
      "numPFACT": 1,
      "PFACTs": [
        1
      ],
      "numNBMIN": 1,
      "NBMINs": [
        8
      ],
      "numPanelsInRecursion": 1,
      "NDIVs": [
        2
      ],
      "numRFACT": 1,
      "RFACTs": [
        1
      ],
      "numBCAST": 1,
      "BCASTs": [
        3
      ],
      "numDEPTH": 1,
      "DEPTHs": [
        2
      ],
      "swapMode": 2,
      "swapThreshold": 192,
      "L1": null,
      "U": null,
      "equilibration": 1,
      "memoryAlignment": 32
    },
    "path": "/raw/HPL_NVIDIA/Sithum/massjob4/HPL.dat"
  },
  "job": {
    "filename": "job.sh",
    "raw": "#!/bin/bash\n#SBATCH --job-name=hpl-test       # Job name\n#SBATCH --ntasks=4                # Total MPI tasks\n#SBATCH --cpus-per-task=4        # CPU cores per MPI task\n#SBATCH --time=01:00:00           # Time limit hh:mm:ss\n#SBATCH --nodelist=node1\n\n# Load MPI module (adjust for your system)\n# module load openmpi\nexport CUDA_VISIBLE_DEVICES=0,1,2,3\nexport HPL_USE_GPU=1\nexport HPL_CUDA_MODE=1\n\nexport PATH=/opt/ompi-4.1.6/bin:$PATH\nexport LD_LIBRARY_PATH=/opt/ompi-4.1.6/lib:$LD_LIBRARY_PATH\nexport LD_LIBRARY_PATH=/usr/local/cuda-12.6/lib64:/opt/nvidia/nvidia_hpc_benchmarks_openmpi/lib/nvshmem:/opt/nvidia/nvidia_hpc_benchmarks_openmpi/lib/nccl:/opt/nvidia/nvidia_hpc_benchmarks_openmpi/lib:$LD_LIBRARY_PATH\n\n#testing\nulimit -l unlimited\nulimit -n 65536\n\n# Run the MPI program\nmpirun ./xhpl-nvidia",
    "sbatch": {
      "job-name": "hpl-test       # Job name",
      "ntasks": null,
      "cpus-per-task": null,
      "time": "01:00:00           # Time limit hh:mm:ss",
      "nodelist": "node1"
    },
    "path": "/raw/HPL_NVIDIA/Sithum/massjob4/job.sh"
  },
  "out": {
    "path": "/raw/HPL_NVIDIA/Sithum/massjob4/job.sh-197.out",
    "runs": [],
    "summary": {
      "testsTotal": null,
      "testsPassed": null,
      "testsFailed": null,
      "testsSkipped": null
    },
    "deviceInfo": {
      "peakClockMHz": 1410,
      "smVersion": 80,
      "numSms": 108
    },
    "memInfo": {
      "DEVICE": {
        "System": {
          "minGiB": 3.54512,
          "maxGiB": 3.54512,
          "avgGiB": 3.54512
        },
        "HPL buffers": {
          "minGiB": 38.37485,
          "maxGiB": 38.89634,
          "avgGiB": 38.63511
        },
        "Used": {
          "minGiB": 41.91996,
          "maxGiB": 42.44146,
          "avgGiB": 42.18022
        },
        "Total": {
          "minGiB": 40,
          "maxGiB": 40,
          "avgGiB": 40
        }
      },
      "HOST": {
        "HPL buffers": {
          "minGiB": 0.00053,
          "maxGiB": 0.00053,
          "avgGiB": 0.00053
        }
      }
    },
    "traces": [
      "[HPL TRACE] cuda_nvshmem_init: max=1.5689 (3) min=1.5689 (2)",
      "[HPL TRACE] ncclCommInitRank: max=0.1704 (1) min=0.1698 (2)",
      "[HPL TRACE] cugetrfs_mp_init: max=0.2232 (0) min=0.2232 (3)",
      "[HPL TRACE] HPL_pdmatgen_gpu: max=0.0260 (2) min=0.0260 (1)"
    ],
    "startTime": null,
    "endTime": null,
    "residual": null,
    "residualPassed": null
  },
  "err": null,
  "best": null
}