{
  "id": "HPL/Ayush/hpl_test",
  "suite": "HPL",
  "group": "Ayush",
  "run": "hpl_test",
  "dat": {
    "raw": "HPLinpack benchmark input file\nInnovative Computing Laboratory, University of Tennessee\nHPL.out      output file name (if any)\n6            device out (6=stdout,7=stderr,file)\n1            # of problems sizes (N)\n276480       Ns\n1            # of NBs\n512          NBs\n1            PMAP process mapping (0=Row-,1=Column-major)\n1            # of process grids (P x Q)\n4            Ps\n4            Qs\n16.0         threshold\n1            # of panel fact\n0 1 2        PFACTs (0=left, 1=Crout, 2=Right)\n1            # of recursive stopping criterium\n2 8          NBMINs (>= 1)\n1            # of panels in recursion\n2            NDIVs\n1            # of recursive panel fact.\n0 1 2        RFACTs (0=left, 1=Crout, 2=Right)\n1            # of broadcast\n3 2          BCASTs (0=1rg,1=1rM,2=2rg,3=2rM,4=Lng,5=LnM)\n1            # of lookahead depth\n1 0          DEPTHs (>=0)\n1            SWAP (0=bin-exch,1=long,2=mix)\n192          swapping threshold\n1            L1 in (0=transposed,1=no-transposed) form\n0            U  in (0=transposed,1=no-transposed) form\n0            Equilibration (0=no,1=yes)\n8            memory alignment in double (> 0)",
    "parsed": {
      "header": [
        "HPLinpack benchmark input file",
        "Innovative Computing Laboratory, University of Tennessee"
      ],
      "outputFilename": "HPL.out",
      "deviceOut": 6,
      "numProblemSizes": 1,
      "Ns": [
        276480
      ],
      "numNBs": 1,
      "NBs": [
        512
      ],
      "pmap": 1,
      "numGrids": 1,
      "Ps": [
        4
      ],
      "Qs": [
        4
      ],
      "threshold": 16,
      "numPFACT": 1,
      "PFACTs": [
        0,
        1,
        2,
        0,
        1,
        2
      ],
      "numNBMIN": 1,
      "NBMINs": [
        2,
        8,
        1
      ],
      "numPanelsInRecursion": 1,
      "NDIVs": [
        2
      ],
      "numRFACT": 1,
      "RFACTs": [
        0,
        1,
        2,
        0,
        1,
        2
      ],
      "numBCAST": 1,
      "BCASTs": [
        3,
        2,
        0,
        1,
        1,
        1,
        2,
        2,
        3,
        2,
        4,
        5
      ],
      "numDEPTH": 1,
      "DEPTHs": [
        1,
        0,
        0
      ],
      "swapMode": 1,
      "swapThreshold": 192,
      "L1": 1,
      "U": 0,
      "equilibration": 0,
      "memoryAlignment": 8
    },
    "path": "/raw/HPL/Ayush/hpl_test/HPL.dat"
  },
  "job": {
    "filename": "job.sh",
    "raw": "#!/bin/bash\n#SBATCH --job-name=hpl-cpu\n#SBATCH --nodes=1\n#SBATCH --ntasks=9                 # matches P×Q in HPL.dat (3×3)\n#SBATCH --ntasks-per-node=9\n#SBATCH --cpus-per-task=3          # OpenMP threads per rank\n#SBATCH --time=01:00:00\n#SBATCH --output=hpl-%j.out\n#SBATCH --error=hpl-%j.err\n\nset -euo pipefail\n\n# Use HPC-X MPI already installed\nexport PATH=\"/home/hpc/hpcx/hpcx-v2.24-gcc-doca_ofed-ubuntu24.04-cuda13-x86_64/ompi/bin:$PATH\"\n\n# If your xhpl needs OpenBLAS/MKL in $HOME/.local/lib, expose it (harmless if not needed)\nexport LD_LIBRARY_PATH=\"$HOME/.local/lib:${LD_LIBRARY_PATH:-}\"\n\n# OpenMP threads = cpus-per-task\nexport OMP_NUM_THREADS=\"${SLURM_CPUS_PER_TASK:-1}\"\n\n# Bind ranks cleanly to cores\nMPI_BIND=\"--bind-to core --map-by socket:PE=${SLURM_CPUS_PER_TASK:-1}\"\n\n# Go where HPL.dat is\ncd \"$(dirname \"$0\")\"\necho \"PWD=$(pwd)\"\necho \"mpirun=$(which mpirun)\"\necho \"Binary=/home/hpc/xhpl\"\necho \"NTASKS=${SLURM_NTASKS:-unset}  OMP_NUM_THREADS=$OMP_NUM_THREADS\"\n\nmpirun ${MPI_BIND} -np \"${SLURM_NTASKS:-9}\" /home/hpc/xhpl\n",
    "sbatch": {
      "job-name": "hpl-cpu",
      "nodes": 1,
      "ntasks": null,
      "ntasks-per-node": 9,
      "cpus-per-task": null,
      "time": "01:00:00",
      "output": "hpl-%j.out",
      "error": "hpl-%j.err"
    },
    "path": "/raw/HPL/Ayush/hpl_test/job.sh"
  },
  "out": {
    "path": "/raw/HPL/Ayush/hpl_test/job.sh-818.out",
    "runs": [],
    "summary": {
      "testsTotal": null,
      "testsPassed": null,
      "testsFailed": null,
      "testsSkipped": null
    }
  },
  "err": {
    "path": "/raw/HPL/Ayush/hpl_test/job.sh-818.err",
    "size": 335
  },
  "best": null
}