{
  "id": "HPL_NVIDIA/Sithum/09-23/09-23 - 3 1",
  "suite": "HPL_NVIDIA",
  "group": "Sithum",
  "run": "09-23/09-23 - 3 1",
  "dat": {
    "raw": "HPLinpack benchmark input file\nInnovative Computing Laboratory, University of Tennessee\nHPL.out      output file name (if any)\n6            device out (6=stdout,7=stderr,file)\n1            # of problems sizes (N)\n189440       Ns\n1            # of NBs\n512          NBs\n1            PMAP process mapping (0=Row-,1=Column-major)\n1            # of process grids (P x Q)\n4            Ps\n2            Qs\n16.0         threshold\n1            # of panel fact\n0 1 2        PFACTs (0=left, 1=Crout, 2=Right)\n1            # of recursive stopping criterium\n2 8          NBMINs (>= 1)\n1            # of panels in recursion\n2            NDIVs\n1            # of recursive panel fact.\n0 1 2        RFACTs (0=left, 1=Crout, 2=Right)\n1            # of broadcast\n3 2          BCASTs (0=1rg,1=1rM,2=2rg,3=2rM,4=Lng,5=LnM)\n1            # of lookahead depth\n1 0          DEPTHs (>=0)\n1            SWAP (0=bin-exch,1=long,2=mix)\n192          swapping threshold\n1            L1 in (0=transposed,1=no-transposed) form\n0            U  in (0=transposed,1=no-transposed) form\n0            Equilibration (0=no,1=yes)\n8            memory alignment in double (> 0)",
    "parsed": {
      "header": [
        "HPLinpack benchmark input file",
        "Innovative Computing Laboratory, University of Tennessee"
      ],
      "outputFilename": "HPL.out",
      "deviceOut": 6,
      "numProblemSizes": 1,
      "Ns": [
        189440
      ],
      "numNBs": 1,
      "NBs": [
        512
      ],
      "pmap": 1,
      "numGrids": 1,
      "Ps": [
        4
      ],
      "Qs": [
        2
      ],
      "threshold": 16,
      "numPFACT": 1,
      "PFACTs": [
        0,
        1,
        2,
        0,
        1,
        2
      ],
      "numNBMIN": 1,
      "NBMINs": [
        2,
        8,
        1
      ],
      "numPanelsInRecursion": 1,
      "NDIVs": [
        2
      ],
      "numRFACT": 1,
      "RFACTs": [
        0,
        1,
        2,
        0,
        1,
        2
      ],
      "numBCAST": 1,
      "BCASTs": [
        3,
        2,
        0,
        1,
        1,
        1,
        2,
        2,
        3,
        2,
        4,
        5
      ],
      "numDEPTH": 1,
      "DEPTHs": [
        1,
        0,
        0
      ],
      "swapMode": 1,
      "swapThreshold": 192,
      "L1": 1,
      "U": 0,
      "equilibration": 0,
      "memoryAlignment": 8
    },
    "path": "/raw/HPL_NVIDIA/Sithum/09-23/09-23 - 3 1/HPL.dat"
  },
  "job": {
    "filename": "job.sh",
    "raw": "#!/bin/bash\n#SBATCH --job-name=hpl-test       # Job name\n#SBATCH --ntasks=16                # Total MPI tasks - 4 x 4\n#SBATCH --ntasks-per-node=4       # balance tasks across nodes - 1 per gpu\n#SBATCH --time=00:03:00           # Time limit hh:mm:ss\n#SBATCH --nodes=4                 #\n#SBATCH --nodelist=node1,node2,node3,node4    # nodes 1 and 2 are the only ones with hpcx for now\n\n# Load HPCX\nsource ~/.bashrc\nexport HPCX_HOME=/home/hpc/hpcx/hpcx-v2.24-gcc-doca_ofed-ubuntu24.04-cuda13-x86_64\nexport LD_LIBRARY_PATH=$HPCX_HOME/ucx/lib:$HPCX_HOME/ompi/lib:$LD_LIBRARY_PATH\nexport PATH=$HPCX_HOME/ompi/bin:$PATH\nsource $HPCX_HOME/hpcx-init.sh\nhpcx_load\n\n# NVIDIA env\nexport CUDA_VISIBLE_DEVICES=0,1,2,3\nexport HPL_USE_GPU=1\nexport HPL_CUDA_MODE=1\n\nENV_SCRIPT_DIR=\"/opt/nvidia/nvidia_hpc_benchmarks_openmpi\"\n\nexport LD_LIBRARY_PATH=\"$ENV_SCRIPT_DIR/lib/cuda${LD_LIBRARY_PATH:+:${LD_LIBRARY_PATH}}\"\n[[ -z \"${NCCL_PATH+x}\" ]] && export LD_LIBRARY_PATH=\"$ENV_SCRIPT_DIR/lib/nccl${LD_LIBRARY_PATH:+:${LD_LIBRARY_PATH}}\"\n[[ -z \"${NVSHMEM_PATH+x}\" ]] && export LD_LIBRARY_PATH=\"$ENV_SCRIPT_DIR/lib/nvshmem${LD_LIBRARY_PATH:+:${LD_LIBRARY_PATH}}\"\n[[ -z \"${NVPL_BLAS_PATH+x}\" ]] && export LD_LIBRARY_PATH=\"$ENV_SCRIPT_DIR/lib/nvpl_blas${LD_LIBRARY_PATH:+:${LD_LIBRARY_PATH}}\"\n[[ -z \"${NVPL_LAPACK_PATH+x}\" ]] && export LD_LIBRARY_PATH=\"$ENV_SCRIPT_DIR/lib/nvpl_lapack${LD_LIBRARY_PATH:+:${LD_LIBRARY_PATH}}\"\n[[ -z \"${NVPL_SPARSE_PATH+x}\" ]] && export LD_LIBRARY_PATH=\"$ENV_SCRIPT_DIR/lib/nvpl_sparse${LD_LIBRARY_PATH:+:${LD_LIBRARY_PATH}}\"\n[[ -z \"${OMP_PATH+x}\" ]] && export LD_LIBRARY_PATH=\"$ENV_SCRIPT_DIR/lib/omp${LD_LIBRARY_PATH:+:${LD_LIBRARY_PATH}}\"\n[[ -z \"${TCMALLOC_PATH+x}\" ]] && export LD_LIBRARY_PATH=\"$ENV_SCRIPT_DIR/lib/tcmalloc${LD_LIBRARY_PATH:+:${LD_LIBRARY_PATH}}\"\n\nexport OMPI_MCA_coll_hcoll_enable=0\n\nexport LD_LIBRARY_PATH=/usr/lib/x86_64-linux-gnu/nvshmem/12:$LD_LIBRARY_PATH\n\n# OMPI / UCX tuning\nexport OMPI_MCA_pml=ucx\nexport OMPI_MCA_osc=ucx\nexport OMPI_MCA_btl=^openib\nexport OMPI_MCA_opal_cuda_support=true\nexport OMPI_MCA_mpi_leave_pinned=1\nexport OMPI_MCA_rmaps_base_mapping_policy=\"ppr:2:numa:pe=8\"\nexport OMPI_MCA_hwloc_base_binding_policy=core\n\nexport UCX_TLS=rc_x,sm,self,cuda_copy,gdr_copy,cuda_ipc\nexport UCX_IB_GPU_DIRECT_RDMA=y\nexport UCX_MEMTYPE_CACHE=y\nexport UCX_RNDV_SCHEME=put_zcopy\nexport UCX_IB_PCI_RELAXED_ORDERING=on\n\n# Ulimits\nulimit -l unlimited\nulimit -n 65536\n\n# Run\nmpirun ./xhpl-nvidia",
    "sbatch": {
      "job-name": "hpl-test       # Job name",
      "ntasks": null,
      "ntasks-per-node": null,
      "time": "00:03:00           # Time limit hh:mm:ss",
      "nodes": null,
      "nodelist": "node1,node2,node3,node4    # nodes 1 and 2 are the only ones with hpcx for now"
    },
    "path": "/raw/HPL_NVIDIA/Sithum/09-23/09-23 - 3 1/job.sh"
  },
  "out": {
    "path": "/raw/HPL_NVIDIA/Sithum/09-23/09-23 - 3 1/job.sh-574.out",
    "runs": [],
    "summary": {
      "testsTotal": null,
      "testsPassed": null,
      "testsFailed": null,
      "testsSkipped": null
    },
    "deviceInfo": {},
    "memInfo": {
      "DEVICE": {},
      "HOST": {}
    },
    "traces": [],
    "startTime": null,
    "endTime": null,
    "residual": null,
    "residualPassed": null
  },
  "err": {
    "path": "/raw/HPL_NVIDIA/Sithum/09-23/09-23 - 3 1/job.sh-574.err",
    "size": 83
  },
  "best": null
}