{
  "id": "HPL/Daniel/14-10-2",
  "suite": "HPL",
  "group": "Daniel",
  "run": "14-10-2",
  "dat": {
    "raw": "HPLinpack benchmark input file\nCustom quick test\nHPL.out      output file name (if any)\n6            device out (6=stdout,7=stderr,file)\n1            # of problems sizes (N)\n65536        Ns\n1            # of NBs\n128          NBs\n0            PMAP process mapping (0=Row-,1=Column-major)\n1            # of process grids (P x Q)\n8            Ps\n16           Qs\n16.0         threshold\n1            # of panel fact\n0            PFACTs (0=left, 1=Crout, 2=Right)\n1            # of recursive stopping criterium\n2            NBMINs (>= 1)\n1            # of panels in recursion\n2            NDIVs\n1            # of recursive panel fact.\n0            RFACTs (0=left, 1=Crout, 2=Right)\n1            # of broadcast\n2            BCASTs (0=1rg,1=1rM,2=2rg,3=2rM,4=Lng,5=LnM)\n1            # of lookahead depth\n1            DEPTHs (>=0)\n2            SWAP (0=bin-exch,1=long,2=mix)\n64           swapping threshold\n0            L1 in (0=transposed,1=no-transposed) form\n0            U  in (0=transposed,1=no-transposed) form\n1            Equilibration (0=no,1=yes)\n8            memory alignment in double (> 0)",
    "parsed": {
      "header": [
        "HPLinpack benchmark input file",
        "Custom quick test"
      ],
      "outputFilename": "HPL.out",
      "deviceOut": 6,
      "numProblemSizes": 1,
      "Ns": [
        65536
      ],
      "numNBs": 1,
      "NBs": [
        128
      ],
      "pmap": 0,
      "numGrids": 1,
      "Ps": [
        8
      ],
      "Qs": [
        16
      ],
      "threshold": 16,
      "numPFACT": 1,
      "PFACTs": [
        0,
        0,
        1,
        2
      ],
      "numNBMIN": 1,
      "NBMINs": [
        2,
        1
      ],
      "numPanelsInRecursion": 1,
      "NDIVs": [
        2
      ],
      "numRFACT": 1,
      "RFACTs": [
        0,
        0,
        1,
        2
      ],
      "numBCAST": 1,
      "BCASTs": [
        2,
        0,
        1,
        1,
        1,
        2,
        2,
        3,
        2,
        4,
        5
      ],
      "numDEPTH": 1,
      "DEPTHs": [
        1,
        0
      ],
      "swapMode": 2,
      "swapThreshold": 64,
      "L1": 0,
      "U": 0,
      "equilibration": 1,
      "memoryAlignment": 8
    },
    "path": "/raw/HPL/Daniel/14-10-2/HPL.dat"
  },
  "job": null,
  "out": null,
  "err": null,
  "best": null
}