{
  "id": "HPL_NVIDIA/Sithum/09-24/09-24 - 11 4",
  "suite": "HPL_NVIDIA",
  "group": "Sithum",
  "run": "09-24/09-24 - 11 4",
  "dat": {
    "raw": "HPLinpack benchmark input file\nInnovative Computing Laboratory, University of Tennessee\nHPL.out      output file name (if any)\n6            device out (6=stdout,7=stderr,file)\n1            # of problems sizes (N)\n275000       Ns\n1            # of NBs\n512          NBs\n1            PMAP process mapping (0=Row-,1=Column-major)\n1            # of process grids (P x Q)\n4            Ps\n4            Qs\n16.0         threshold\n1            # of panel fact\n0 1 2        PFACTs (0=left, 1=Crout, 2=Right)\n1            # of recursive stopping criterium\n2 8          NBMINs (>= 1)\n1            # of panels in recursion\n2            NDIVs\n1            # of recursive panel fact.\n0 1 2        RFACTs (0=left, 1=Crout, 2=Right)\n1            # of broadcast\n3 2          BCASTs (0=1rg,1=1rM,2=2rg,3=2rM,4=Lng,5=LnM)\n1            # of lookahead depth\n1 0          DEPTHs (>=0)\n1            SWAP (0=bin-exch,1=long,2=mix)\n192          swapping threshold\n1            L1 in (0=transposed,1=no-transposed) form\n0            U  in (0=transposed,1=no-transposed) form\n0            Equilibration (0=no,1=yes)\n8            memory alignment in double (> 0)",
    "parsed": {
      "header": [
        "HPLinpack benchmark input file",
        "Innovative Computing Laboratory, University of Tennessee"
      ],
      "outputFilename": "HPL.out",
      "deviceOut": 6,
      "numProblemSizes": 1,
      "Ns": [
        275000
      ],
      "numNBs": 1,
      "NBs": [
        512
      ],
      "pmap": 1,
      "numGrids": 1,
      "Ps": [
        4
      ],
      "Qs": [
        4
      ],
      "threshold": 16,
      "numPFACT": 1,
      "PFACTs": [
        0,
        1,
        2,
        0,
        1,
        2
      ],
      "numNBMIN": 1,
      "NBMINs": [
        2,
        8,
        1
      ],
      "numPanelsInRecursion": 1,
      "NDIVs": [
        2
      ],
      "numRFACT": 1,
      "RFACTs": [
        0,
        1,
        2,
        0,
        1,
        2
      ],
      "numBCAST": 1,
      "BCASTs": [
        3,
        2,
        0,
        1,
        1,
        1,
        2,
        2,
        3,
        2,
        4,
        5
      ],
      "numDEPTH": 1,
      "DEPTHs": [
        1,
        0,
        0
      ],
      "swapMode": 1,
      "swapThreshold": 192,
      "L1": 1,
      "U": 0,
      "equilibration": 0,
      "memoryAlignment": 8
    },
    "path": "/raw/HPL_NVIDIA/Sithum/09-24/09-24 - 11 4/HPL.dat"
  },
  "job": {
    "filename": "job.sh",
    "raw": "#!/bin/bash\n#SBATCH --job-name=hpl-test       # Job name\n#SBATCH --ntasks=16                # Total MPI tasks - 4 x 4\n#SBATCH --ntasks-per-node=4       # balance tasks across nodes - 1 per gpu\n#SBATCH --time=00:03:00           # Time limit hh:mm:ss\n#SBATCH --nodes=4                 #\n#SBATCH --nodelist=node1,node2,node3,node4    # nodes 1 and 2 are the only ones with hpcx for now\n\n# Load HPCX\nsource ~/.bashrc\nexport HPCX_HOME=/home/hpc/hpcx/hpcx-v2.24-gcc-doca_ofed-ubuntu24.04-cuda13-x86_64\nexport LD_LIBRARY_PATH=$HPCX_HOME/ucx/lib:$HPCX_HOME/ompi/lib:$LD_LIBRARY_PATH\nexport PATH=$HPCX_HOME/ompi/bin:$PATH\nsource $HPCX_HOME/hpcx-init.sh\nhpcx_load\n\n# NVIDIA env\nexport CUDA_VISIBLE_DEVICES=0,1,2,3\nexport HPL_USE_GPU=1\nexport HPL_CUDA_MODE=1\n\n# ---- NCCL choice: use system 2.27.7 ----\nunset LD_PRELOAD\nexport LD_LIBRARY_PATH=/usr/lib/x86_64-linux-gnu:$LD_LIBRARY_PATH\n\n# Optional: add CUDA & other NVIDIA libs, but *not* /opt/.../lib/nccl\nexport LD_LIBRARY_PATH=/opt/nvidia/nvidia_hpc_benchmarks_openmpi/lib/omp:$LD_LIBRARY_PATH\nexport LD_LIBRARY_PATH=/usr/local/cuda-12.6/lib64:/opt/nvidia/nvidia_hpc_benchmarks_openmpi/lib:$LD_LIBRARY_PATH\nexport LD_LIBRARY_PATH=/usr/lib/x86_64-linux-gnu/nvshmem/12:$LD_LIBRARY_PATH\n\nexport NCCL_LAUNCH_MODE=GROUP\nexport NCCL_ALGO=Ring\nexport NCCL_PROTO=Simple\nexport NVSHMEM_USE_CUDA_MEMCPY=1\n\n# OMPI / UCX tuning\nexport OMPI_MCA_pml=ucx\nexport OMPI_MCA_osc=ucx\nexport OMPI_MCA_btl=^openib\nexport OMPI_MCA_opal_cuda_support=true\nexport OMPI_MCA_mpi_leave_pinned=1\nexport OMPI_MCA_rmaps_base_mapping_policy=slot\nexport OMPI_MCA_hwloc_base_binding_policy=numa\nexport OMPI_MCA_coll_hcoll_enable=0\nexport OMPI_MCA_coll_tuned_use_dynamic_rules=1\nexport OMPI_MCA_coll_tuned_allreduce_algorithm=5   # recursive doubling\nexport OMPI_MCA_coll_tuned_reduce_algorithm=6      # Rabenseifner\n\nexport UCX_TLS=rc,sm,self,cuda_copy,cuda_ipc,gdr_copy\nexport UCX_NET_DEVICES=all\nexport UCX_MAX_RNDV_RAILS=2\nexport UCX_RNDV_THRESH=16384\nexport UCX_IB_GPU_DIRECT_RDMA=yes\nexport UCX_MEMTYPE_CACHE=n\n\n# Ulimits\nulimit -l unlimited\nulimit -n 65536\n\n# Run\nmpirun ./xhpl-nvidia",
    "sbatch": {
      "job-name": "hpl-test       # Job name",
      "ntasks": null,
      "ntasks-per-node": null,
      "time": "00:03:00           # Time limit hh:mm:ss",
      "nodes": null,
      "nodelist": "node1,node2,node3,node4    # nodes 1 and 2 are the only ones with hpcx for now"
    },
    "path": "/raw/HPL_NVIDIA/Sithum/09-24/09-24 - 11 4/job.sh"
  },
  "out": {
    "path": "/raw/HPL_NVIDIA/Sithum/09-24/09-24 - 11 4/job.sh-753.out",
    "runs": [
      {
        "tv": "WC0",
        "N": 274944,
        "NB": 512,
        "P": 4,
        "Q": 4,
        "timeSec": 138.94,
        "gflops": 99730,
        "gflopsPerGpu": 6233
      }
    ],
    "summary": {
      "testsTotal": 1,
      "testsPassed": 1,
      "testsFailed": 0,
      "testsSkipped": 0
    },
    "deviceInfo": {
      "peakClockMHz": 1410,
      "smVersion": 80,
      "numSms": 108
    },
    "memInfo": {
      "DEVICE": {
        "System": {
          "minGiB": 2.76079,
          "maxGiB": 2.76079,
          "avgGiB": 2.76079
        },
        "HPL buffers": {
          "minGiB": 38.90532,
          "maxGiB": 39.43071,
          "avgGiB": 39.0363
        },
        "Used": {
          "minGiB": 41.6661,
          "maxGiB": 42.1915,
          "avgGiB": 41.79709
        },
        "Total": {
          "minGiB": 40,
          "maxGiB": 40,
          "avgGiB": 40
        }
      },
      "HOST": {
        "HPL buffers": {
          "minGiB": 0.00055,
          "maxGiB": 0.00055,
          "avgGiB": 0.00055
        }
      }
    },
    "traces": [
      "[HPL TRACE] cuda_nvshmem_init: max=1.1485 (0) min=1.1481 (7)",
      "[HPL TRACE] ncclCommInitRank: max=0.0832 (10) min=0.0823 (14)",
      "[HPL TRACE] cugetrfs_mp_init: max=0.1573 (0) min=0.1570 (4)",
      "[HPL TRACE] HPL_pdmatgen_gpu: max=0.0290 (10) min=0.0287 (12)"
    ],
    "startTime": "Wed Sep 24 07:19:10 2025",
    "endTime": "Wed Sep 24 07:21:28 2025",
    "residual": 0.000331802083,
    "residualPassed": true
  },
  "err": null,
  "best": {
    "gflops": 99730,
    "N": 274944,
    "NB": 512,
    "timeSec": 138.94
  }
}