{
  "id": "HPL_NVIDIA/Sithum/massjob2",
  "suite": "HPL_NVIDIA",
  "group": "Sithum",
  "run": "massjob2",
  "dat": {
    "raw": "HPLinpack benchmark input file\nInnovative Computing Laboratory, University of Tennessee\nHPL.out      output file name (if any)\n6            device out (6=stdout,7=stderr,file)\n1            # of problems sizes (N)\n133120       Ns\n1            # of NBs\n512          NBs\n1            PMAP process mapping (0=Row-,1=Column-major)\n1            # of process grids (P x Q)\n2            Ps\n2            Qs\n16.0         threshold\n1            # of panel fact\n1            PFACTs (ignored by HPL-NVIDIA)\n1            # of recursive stopping criterium\n8            NBMINs (ignored)\n1            # of panels in recursion\n2            NDIVs\n1            # of recursive panel fact.\n1            RFACTs (ignored)\n1            # of broadcast\n3            BCASTs (ignored)\n1            # of lookahead depth\n2            DEPTHs (ignored)\n2            SWAP (0=bin-exch,1=long,2=mix)\n192          swapping threshold\n0            L1 in (ignored)\n1            U  in (ignored)\n1            Equilibration (ignored)\n32           memory alignment in double (> 0, ignored)",
    "parsed": {
      "header": [
        "HPLinpack benchmark input file",
        "Innovative Computing Laboratory, University of Tennessee"
      ],
      "outputFilename": "HPL.out",
      "deviceOut": 6,
      "numProblemSizes": 1,
      "Ns": [
        133120
      ],
      "numNBs": 1,
      "NBs": [
        512
      ],
      "pmap": 1,
      "numGrids": 1,
      "Ps": [
        2
      ],
      "Qs": [
        2
      ],
      "threshold": 16,
      "numPFACT": 1,
      "PFACTs": [
        1
      ],
      "numNBMIN": 1,
      "NBMINs": [
        8
      ],
      "numPanelsInRecursion": 1,
      "NDIVs": [
        2
      ],
      "numRFACT": 1,
      "RFACTs": [
        1
      ],
      "numBCAST": 1,
      "BCASTs": [
        3
      ],
      "numDEPTH": 1,
      "DEPTHs": [
        2
      ],
      "swapMode": 2,
      "swapThreshold": 192,
      "L1": null,
      "U": null,
      "equilibration": 1,
      "memoryAlignment": 32
    },
    "path": "/raw/HPL_NVIDIA/Sithum/massjob2/HPL.dat"
  },
  "job": {
    "filename": "job.sh",
    "raw": "#!/bin/bash\n#SBATCH --job-name=hpl-test       # Job name\n#SBATCH --ntasks=4                # Total MPI tasks\n#SBATCH --cpus-per-task=4        # CPU cores per MPI task\n#SBATCH --time=01:00:00           # Time limit hh:mm:ss\n#SBATCH --nodelist=node1\n\n# Load MPI module (adjust for your system)\n# module load openmpi\nexport CUDA_VISIBLE_DEVICES=0,1,2,3\nexport HPL_USE_GPU=1\nexport HPL_CUDA_MODE=1\n\nexport PATH=/opt/ompi-4.1.6/bin:$PATH\nexport LD_LIBRARY_PATH=/opt/ompi-4.1.6/lib:$LD_LIBRARY_PATH\nexport LD_LIBRARY_PATH=/usr/local/cuda-12.6/lib64:/opt/nvidia/nvidia_hpc_benchmarks_openmpi/lib/nvshmem:/opt/nvidia/nvidia_hpc_benchmarks_openmpi/lib/nccl:/opt/nvidia/nvidia_hpc_benchmarks_openmpi/lib:$LD_LIBRARY_PATH\n\n#testing\nulimit -l unlimited\nulimit -n 65536\n\n# Run the MPI program\nmpirun ./xhpl-nvidia",
    "sbatch": {
      "job-name": "hpl-test       # Job name",
      "ntasks": null,
      "cpus-per-task": null,
      "time": "01:00:00           # Time limit hh:mm:ss",
      "nodelist": "node1"
    },
    "path": "/raw/HPL_NVIDIA/Sithum/massjob2/job.sh"
  },
  "out": {
    "path": "/raw/HPL_NVIDIA/Sithum/massjob2/job.sh-195.out",
    "runs": [
      {
        "tv": "WC0",
        "N": 133120,
        "NB": 512,
        "P": 2,
        "Q": 2,
        "timeSec": 24.15,
        "gflops": 65130,
        "gflopsPerGpu": 16280
      }
    ],
    "summary": {
      "testsTotal": 1,
      "testsPassed": 1,
      "testsFailed": 0,
      "testsSkipped": 0
    },
    "deviceInfo": {
      "peakClockMHz": 1410,
      "smVersion": 80,
      "numSms": 108
    },
    "memInfo": {
      "DEVICE": {
        "System": {
          "minGiB": 3.5686,
          "maxGiB": 3.5686,
          "avgGiB": 3.5686
        },
        "HPL buffers": {
          "minGiB": 36.81025,
          "maxGiB": 36.81025,
          "avgGiB": 36.81025
        },
        "Used": {
          "minGiB": 40.37885,
          "maxGiB": 40.37885,
          "avgGiB": 40.37885
        },
        "Total": {
          "minGiB": 40,
          "maxGiB": 40,
          "avgGiB": 40
        }
      },
      "HOST": {
        "HPL buffers": {
          "minGiB": 0.00052,
          "maxGiB": 0.00052,
          "avgGiB": 0.00052
        }
      }
    },
    "traces": [
      "[HPL TRACE] cuda_nvshmem_init: max=1.5819 (3) min=1.5819 (2)",
      "[HPL TRACE] ncclCommInitRank: max=0.1738 (2) min=0.1737 (1)",
      "[HPL TRACE] cugetrfs_mp_init: max=0.2264 (0) min=0.2263 (3)",
      "[HPL TRACE] HPL_pdmatgen_gpu: max=0.0245 (3) min=0.0244 (0)"
    ],
    "startTime": "Fri Aug 29 05:02:13 2025",
    "endTime": "Fri Aug 29 05:02:37 2025",
    "residual": 0.000499457529,
    "residualPassed": true
  },
  "err": null,
  "best": {
    "gflops": 65130,
    "N": 133120,
    "NB": 512,
    "timeSec": 24.15
  }
}